{"$schema":"http://json-schema.org/draft-07/schema#","title":"GuidedWorkflow","type":"object","additionalProperties":false,"required":["workflowId","workflowName","targetUrlPattern","steps"],"properties":{"workflowId":{"type":"string","minLength":1},"workflowName":{"type":"string","minLength":1},"description":{"type":"string"},"targetUrlPattern":{"type":"string","minLength":1},"globalInjections":{"type":"object","additionalProperties":{"type":"string"}},"steps":{"type":"array","items":{"type":"object","additionalProperties":false,"required":["stepIndex","actionType","instruction","elementFingerprint"],"properties":{"stepIndex":{"type":"integer","minimum":1},"actionType":{"enum":["click","input","select","hover","verify"]},"instruction":{"type":"string","minLength":1},"injectData":{"type":"string"},"autoPilot":{"type":"boolean"},"elementFingerprint":{"type":"object","additionalProperties":false,"required":["tagName","cssFallback"],"properties":{"tagName":{"type":"string","minLength":1},"id":{"type":["string","null"]},"testId":{"type":["string","null"]},"name":{"type":["string","null"]},"type":{"type":["string","null"]},"role":{"type":["string","null"]},"ariaLabel":{"type":["string","null"]},"placeholder":{"type":["string","null"]},"title":{"type":["string","null"]},"alt":{"type":["string","null"]},"value":{"type":["string","null"]},"labelText":{"type":["string","null"]},"innerTextSnippet":{"type":["string","null"]},"cssFallback":{"type":"string","minLength":1}}},"validation":{"type":"object","properties":{"rule":{"enum":["exact_match","not_empty","regex","numeric_range","element_exists","element_hidden"]},"expectedValue":{"type":"string"},"minValue":{"type":"number"},"maxValue":{"type":"number"},"errorMessage":{"type":"string"}}}}}}}}
