{"workflowId":"demo-001","workflowName":"Demo onboarding","targetUrlPattern":"https://example.com/*","globalInjections":{"email":"learner@example.com"},"steps":[{"stepIndex":1,"actionType":"input","instruction":"Enter your email","injectData":"${email}","elementFingerprint":{"tagName":"input","name":"email","cssFallback":"input[name=\"email\"]"},"validation":{"rule":"not_empty","errorMessage":"Email is required."}}]}
